[
  {
    "headword": "toit",
    "pronunciation": "toit",
    "pronunciation_with_stress": "toit",
    "gender": "le",
    "part_of_speech": "zn",
    "plural": "toits",
    "diminutive": "",
    "verb_forms": "",
    "conjugation_table": null,
    "inflected_form": "",
    "comparative": "",
    "superlative": "",
    "derivations": "",
    "alternate_headwords": [],
    "cross_reference": null,
    "is_nt2_2000": false,
    "meanings": [
      {
        "definition": "Partie superieure d une maison.",
        "context": "",
        "examples": [
          "le toit protege la maison"
        ],
        "idioms": []
      }
    ],
    "audio_links": {},
    "images": [],
    "_metadata": {
      "search_term": "toit",
      "headword_raw": "toit",
      "index": 94002,
      "dictionaryId": "fr-test-core",
      "dictionary_name": "FR Core Test",
      "fixture": true
    },
    "meaning_id": 1
  }
]
