[
  {
    "headword": "run",
    "pronunciation": "run",
    "pronunciation_with_stress": "run",
    "gender": "",
    "part_of_speech": "ww",
    "plural": "",
    "diminutive": "",
    "verb_forms": "ran, has run",
    "conjugation_table": {
      "present": {
        "i": "run",
        "you": "run",
        "he_she_it": "runs",
        "we": "run",
        "they": "run"
      },
      "past": {
        "i": "ran",
        "you": "ran",
        "he_she_it": "ran",
        "we": "ran",
        "they": "ran"
      },
      "perfect": {
        "auxiliary": "has",
        "participle": "run"
      }
    },
    "inflected_form": "",
    "comparative": "",
    "superlative": "",
    "derivations": "",
    "alternate_headwords": [],
    "cross_reference": null,
    "is_nt2_2000": false,
    "meanings": [
      {
        "definition": "To move quickly on foot.",
        "context": "a person moves",
        "examples": [
          "They run beside the river every morning."
        ],
        "idioms": [
          {
            "expression": "run out of time",
            "explanation": "have no time left",
            "examples": [
              "We ran out of time before the test ended."
            ]
          }
        ],
        "synonyms": [
          "jog"
        ],
        "antonyms": [
          "stop"
        ],
        "related_terms": [
          "runner"
        ],
        "usage_labels": [
          "fixture"
        ],
        "grammar": {
          "auxiliary": "have"
        },
        "note": "Synthetic local fixture entry for multilingual QA.",
        "cross_references": []
      }
    ],
    "audio_links": {},
    "images": [],
    "reference_tables": [],
    "_metadata": {
      "search_term": "run",
      "headword_raw": "run",
      "index": 98001,
      "dictionaryId": "en-cambridge-test",
      "dictionary_name": "Cambridge-like EN Test (synthetic)",
      "fixture": true
    },
    "meaning_id": 1,
    "_source": {
      "identity_scheme_version": "local-complete-fixture-v1",
      "identity_evidence": {
        "kind": "deterministic-local-complete-fixture",
        "dictionary_id": "en-cambridge-test",
        "provider_article_id": "en-cambridge-test:98001"
      },
      "provider_article_id": "en-cambridge-test:98001",
      "normalized_pos_status": "known",
      "pos_evidence": {
        "normalized_pos_status": "known",
        "source": "local-fixture",
        "raw_value": "ww"
      },
      "source_group_key": "local-complete-fixture-v1:en-cambridge-test:98001",
      "source_entry_key": "local-complete-fixture-v1:en-cambridge-test:98001",
      "source_index": 98001,
      "sense_ordinal": 1
    }
  }
]
