[
  {
    "headword": "jardin",
    "pronunciation": "jardin",
    "pronunciation_with_stress": "jardin",
    "gender": "le",
    "part_of_speech": "zn",
    "plural": "jardins",
    "diminutive": "",
    "verb_forms": "",
    "conjugation_table": null,
    "inflected_form": "",
    "comparative": "",
    "superlative": "",
    "derivations": "",
    "alternate_headwords": [],
    "cross_reference": null,
    "is_nt2_2000": false,
    "meanings": [
      {
        "definition": "Terrain avec des plantes pres d une maison.",
        "context": "",
        "examples": [
          "le jardin est derriere la maison"
        ],
        "idioms": []
      }
    ],
    "audio_links": {},
    "images": [],
    "_metadata": {
      "search_term": "jardin",
      "headword_raw": "jardin",
      "index": 95004,
      "dictionaryId": "fr-test-extra",
      "dictionary_name": "FR Extra Test",
      "fixture": true
    },
    "meaning_id": 1
  }
]
