[
  {
    "headword": "cle",
    "pronunciation": "cle",
    "pronunciation_with_stress": "cle",
    "gender": "la",
    "part_of_speech": "zn",
    "plural": "cles",
    "diminutive": "",
    "verb_forms": "",
    "conjugation_table": null,
    "inflected_form": "",
    "comparative": "",
    "superlative": "",
    "derivations": "",
    "alternate_headwords": [],
    "cross_reference": null,
    "is_nt2_2000": false,
    "meanings": [
      {
        "definition": "Petit objet qui ouvre une serrure.",
        "context": "",
        "examples": [
          "la cle de la maison est ici"
        ],
        "idioms": []
      }
    ],
    "audio_links": {},
    "images": [],
    "_metadata": {
      "search_term": "cle",
      "headword_raw": "cle",
      "index": 95002,
      "dictionaryId": "fr-test-extra",
      "dictionary_name": "FR Extra Test",
      "fixture": true
    },
    "meaning_id": 1
  }
]
