[
  {
    "headword": "banque",
    "pronunciation": "banque",
    "pronunciation_with_stress": "banque",
    "gender": "la",
    "part_of_speech": "zn",
    "plural": "banques",
    "diminutive": "",
    "verb_forms": "",
    "conjugation_table": null,
    "inflected_form": "",
    "comparative": "",
    "superlative": "",
    "derivations": "",
    "alternate_headwords": [],
    "cross_reference": null,
    "is_nt2_2000": false,
    "meanings": [
      {
        "definition": "Établissement qui conserve et gère de l argent.",
        "context": "la finance",
        "examples": [
          "La banque ouvre à neuf heures."
        ],
        "idioms": [
          {
            "expression": "faire sauter la banque",
            "explanation": "gagner une très grande somme",
            "examples": [
              "Le joueur a fait sauter la banque."
            ]
          }
        ],
        "synonyms": [
          "établissement financier"
        ],
        "antonyms": [],
        "related_terms": [
          "compte",
          "argent"
        ],
        "usage_labels": [
          "fixture"
        ],
        "grammar": {
          "article": "la"
        },
        "note": "Synthetic local fixture entry for multilingual QA.",
        "cross_references": []
      }
    ],
    "audio_links": {},
    "images": [],
    "reference_tables": [],
    "_metadata": {
      "search_term": "banque",
      "headword_raw": "banque",
      "index": 99004,
      "dictionaryId": "fr-larousse-test",
      "dictionary_name": "Larousse-like FR Test (synthetic)",
      "fixture": true
    },
    "meaning_id": 1,
    "_source": {
      "identity_scheme_version": "local-complete-fixture-v1",
      "identity_evidence": {
        "kind": "deterministic-local-complete-fixture",
        "dictionary_id": "fr-larousse-test",
        "provider_article_id": "fr-larousse-test:99004"
      },
      "provider_article_id": "fr-larousse-test:99004",
      "normalized_pos_status": "known",
      "pos_evidence": {
        "normalized_pos_status": "known",
        "source": "local-fixture",
        "raw_value": "zn"
      },
      "source_group_key": "local-complete-fixture-v1:fr-larousse-test:99004",
      "source_entry_key": "local-complete-fixture-v1:fr-larousse-test:99004",
      "source_index": 99004,
      "sense_ordinal": 1
    }
  }
]
