[
  {
    "headword": "chambre",
    "pronunciation": "chambre",
    "pronunciation_with_stress": "chambre",
    "gender": "la",
    "part_of_speech": "zn",
    "plural": "chambres",
    "diminutive": "",
    "verb_forms": "",
    "conjugation_table": null,
    "inflected_form": "",
    "comparative": "",
    "superlative": "",
    "derivations": "",
    "alternate_headwords": [],
    "cross_reference": null,
    "is_nt2_2000": false,
    "meanings": [
      {
        "definition": "Pièce destinée notamment au sommeil.",
        "context": "une pièce d habitation",
        "examples": [
          "La chambre donne sur la cour."
        ],
        "idioms": [
          {
            "expression": "chambre d écho",
            "explanation": "lieu où les mêmes idées se répètent",
            "examples": [
              "Le groupe est devenu une chambre d écho."
            ]
          }
        ],
        "synonyms": [
          "pièce"
        ],
        "antonyms": [],
        "related_terms": [
          "lit",
          "maison"
        ],
        "usage_labels": [
          "fixture"
        ],
        "grammar": {
          "article": "la"
        },
        "note": "Synthetic local fixture entry for multilingual QA.",
        "cross_references": []
      }
    ],
    "audio_links": {},
    "images": [],
    "reference_tables": [],
    "_metadata": {
      "search_term": "chambre",
      "headword_raw": "chambre",
      "index": 99007,
      "dictionaryId": "fr-larousse-test",
      "dictionary_name": "Larousse-like FR Test (synthetic)",
      "fixture": true
    },
    "meaning_id": 1,
    "_source": {
      "identity_scheme_version": "local-complete-fixture-v1",
      "identity_evidence": {
        "kind": "deterministic-local-complete-fixture",
        "dictionary_id": "fr-larousse-test",
        "provider_article_id": "fr-larousse-test:99007"
      },
      "provider_article_id": "fr-larousse-test:99007",
      "normalized_pos_status": "known",
      "pos_evidence": {
        "normalized_pos_status": "known",
        "source": "local-fixture",
        "raw_value": "zn"
      },
      "source_group_key": "local-complete-fixture-v1:fr-larousse-test:99007",
      "source_entry_key": "local-complete-fixture-v1:fr-larousse-test:99007",
      "source_index": 99007,
      "sense_ordinal": 1
    }
  }
]
